{
  "id": "voron_2_4_250",
  "name": "Voron 2.4 250",
  "family": "voron",
  "kinematics": "corexy",
  "version": 1,
  "build_volume": {
    "x": 250,
    "y": 250,
    "z": 210
  },
  "supported_boards": [
    "btt_octopus_1_1",
    "btt_octopus_pro_1_1",
    "manta_m8p_v2",
    "btt_skr_1_3",
    "btt_skr_1_4"
  ],
  "defaults": {
    "max_velocity": 300,
    "max_accel": 3000,
    "square_corner_velocity": 5.0
  },
  "feature_flags": {
    "probe_optional": true,
    "input_shaper_optional": true,
    "macros_supported": true
  },
  "templates": {
    "printer": "printer.cfg.j2",
    "mcu": "mcu.cfg.j2",
    "motion": "motion_corexy.cfg.j2",
    "thermal": "thermal.cfg.j2"
  },
  "recommended_probe_types": [
    "inductive",
    "tap",
    "bltouch"
  ],
  "notes": "Re-ingested from VoronDesign/Voron-2 firmware/klipper_configurations @ a192410e27ea345644ae5c4b29b4c9c40cbe1a73.",
  "supported_toolhead_boards": [
    "btt_ebb36_v1_2",
    "btt_ebb42_v1_2",
    "btt_ebb_sb2209_2240",
    "btt_ebb2240_v1_0",
    "ldo_nitehawk_sb",
    "ldo_nitehawk_36",
    "mellow_fly_sht36_v2",
    "mellow_fly_sht42_v2",
    "fysetc_sb_can_2040"
  ],
  "supported_addons": [
    "ams_lite",
    "ercf_v2",
    "box_turtle",
    "trad_rack",
    "filament_buffer"
  ]
}
